{
  "schema_version": 1,
  "registry_id": "hepta-external-authority-trust-registry-v1",
  "registry_revision": "replace-with-separately-administered-revision",
  "issued_at": "1970-01-01T00:00:00Z",
  "expires_at": "1970-01-01T00:00:00Z",
  "keys": [
    {
      "key_id": "replace-with-ed25519-key-id",
      "identity": "replace-with-authoritative-identity",
      "organization": "replace-with-authoritative-organization",
      "algorithm": "ed25519",
      "public_key_uri": "key://keys/replace-with-public-key.pem",
      "public_key_sha256": "0000000000000000000000000000000000000000000000000000000000000000",
      "usages": ["evidence_issuer"],
      "authority_classes": ["repository_administrator"],
      "allowed_gap_ids": ["HG-0017"],
      "valid_from": "1970-01-01T00:00:00Z",
      "valid_until": "1970-01-01T00:00:00Z",
      "revoked_at": null
    }
  ]
}
